{
  "title": "whykay @ dev.to",
  "type": "blog",
  "url": "https://dev.to/whykay",
  "photo_url": "https://media.licdn.com/dms/image/D4E03AQG3lcPFRvoCLA/profile-displayphoto-shrink_800_800/0/1671633150179?e=2147483647&v=beta&t=PIBSiQwOS4UE9OQ31JLrmWUoMEk8a4xSo3cUmiPaxg8",
  "language": "en", 
  "rss_feed": "https://dev.to/feed/whykay", 
  "authors": [ 
    {
      "name": "Vicky Twomey-Lee",
      "social_media": [{
         "twitter": "whykay",
         "mastodon": "@whykay@mastodon.ie",
         "github": "whykay",
         "instagram": "theycallmejanie",
         "website": "https://beacons.page/whykay",
         "linkedin": "vickyleeire",
         "bluesky": "@whykay.bsky.social"
      }]
    }
  ]
}
