{
  "title": "Isabel Zimmerman",
  "type": "blog",
  "url": "https://isabelizimm.github.io/",
  "rss_feed": "https://isabelizimm.github.io/blog-python.xml",
  "photo_url": "https://avatars.githubusercontent.com/u/54685329?v=4",
  "language": "en",
  "authors": [ 
    {
      "name": "Isabel Zimmerman",
      "social_media": [{
         "x": "@isabelizimm",
         "mastodon": "@isabelizimm@fosstodon.org",
         "github": "isabelizimm",
         "linkedin": "isabel-zimmerman",
         "bluesky": "@isabelizimm.bsky.social"
      }]
    }
  ]
}
