{
  "title": "Alison Orellana Rios",
  "type": "blog",
  "url": "https://medium.com/@ALLY_OR",
  "photo_url": "https://github.com/AllyOR.png",
  "language": "es",
  "rss_feed": "https://medium.com/feed/@ALLY_OR",
  "description": "Python programming fundamentals, logic, and digital literacy — in Spanish",
  "authors": [
    {
      "name": "Alison Orellana Rios",
      "social_media": [{
        "github": "AllyOR",
        "x": "ALLY_OR_ENEMY",
        "website": "https://linktr.ee/AllyOR"
      }]
    }
  ]
}
