{
  "title": "PyLadies Austin",
  "type": "youtube",
  "url": "https://www.youtube.com/channel/UCcpaCF13pUTgi-aWumEnk1Q",
  "photo_url": "https://pyladies.com/assets/images/pyladies_atx.jpeg",
  "language": "en",
  "rss_feed": "https://www.youtube.com/feeds/videos.xml?channel_id=UCcpaCF13pUTgi-aWumEnk1Q",
  "authors": [
    {
      "name": "PyLadies Austin",
      "social_media": [
        {
          "x": "https://twitter.com/pyladiesATX",
          "meetup": "https://www.meetup.com/pyladies-atx/",
          "youtube": "https://www.youtube.com/channel/UCcpaCF13pUTgi-aWumEnk1Q"
        }
      ]
    }
  ]
}