{
    "title": "Lynn Root",
    "type": "blog",
    "url": "https://roguelynn.com/words",
    "photo_url": "https://www.roguelynn.com/images/self_square.png",
    "rss_feed": "https://www.roguelynn.com/index.xml",
    "language": "en",
    "authors": [
      {
        "name": "Lynn Root",
        "social_media": [{
          "x": "roguelynn",
          "mastodon": "@roguelynn@mastodon.online",
          "github": "econchick",
          "website": "https://roguelynn.com",
          "linkedin": "lynnroot",
          "instagram": "roguelynn"
        }]
      }
    ]
  }
  