{
  "title": "Ines Montani",
  "type": "blog",
  "url": "https://ines.io",
  "rss_feed": "https://ines.io/feed",
  "photo_url": "https://ines.io/static/31a698b834e1e4b6f7d15b9b306a9439/e9e8b/profile.jpg",
  "language": "en",
  "authors": [
    {
      "name": "Ines Montani",
      "social_media": [
        {
          "x": "@_inesmontani",
          "mastodon": "@ines@sigmoid.social",
          "github": "ines",
          "website": "https://ines.io",
          "linkedin": "inesmontani/"
        }
      ]
    }
  ]
}
