{
  "title": "Emily Riederer", 
  "type": "blog", 
  "url": "https://emilyriederer.com", 
  "photo_url": "https://avatars.githubusercontent.com/u/19798371",
  "description": "Thoughts on advancing the data analysis lifecycle -- from data quality and management, reproducible tooling, and statistical methods",
  "language": "en", 
  "rss_feed": "https://www.emilyriederer.com/tags/python/index.xml", 
  "authors": [ 
    {
      "name": "Emily Riederer", 
      "social_media": [{
         "x": "emilyriederer",
         "mastodon": "@emilyriederer@mastodon.social",
         "github": "emilyriederer",
         "website": "emilyriederer.com",
         "linkedin": "emilyriederer/",
         "facebook": "emilyriederer",
         "orcid": "0000-0002-1788-7934",
         "bluesky": "@emilyriederer.bsky.social"
      }]
    }
  ]
}
